{
  "$schema": "https://json-schema.org/draft/2020-12/schema",
  "title": "Tuvima Network Settings",
  "type": "object",
  "additionalProperties": false,
  "required": ["schema_version", "local", "remote", "streaming"],
  "properties": {
    "schema_version": { "const": "3.0" },
    "local": {
      "type": "object",
      "additionalProperties": false,
      "required": ["port", "bind_mode", "discovery_enabled", "preferred_server_name", "ipv6_enabled"],
      "properties": {
        "port": { "type": "integer", "minimum": 1, "maximum": 65535 },
        "bind_mode": { "enum": ["automatic", "specific-interface"] },
        "interface_id": { "type": ["string", "null"] },
        "discovery_enabled": { "type": "boolean" },
        "preferred_server_name": { "type": "string", "pattern": "^(?!-)[A-Za-z0-9-]{1,63}(?<!-)$" },
        "ipv6_enabled": { "type": "boolean" },
        "allowed_hostnames": {
          "type": "array",
          "maxItems": 32,
          "uniqueItems": true,
          "items": { "type": "string", "pattern": "^(?!-)[A-Za-z0-9-]{1,63}(?<!-)(\\.(?!-)[A-Za-z0-9-]{1,63}(?<!-))*$" }
        }
      }
    },
    "remote": {
      "type": "object",
      "additionalProperties": false,
      "required": ["connection_mode", "automatic_router_configuration", "trusted_proxies", "trusted_proxy_networks"],
      "properties": {
        "connection_mode": { "enum": ["local-only", "tailscale", "direct-only", "custom"] },
        "automatic_router_configuration": { "type": "boolean" },
        "external_port": { "type": ["integer", "null"], "minimum": 1, "maximum": 65535 },
        "tls_termination_port": { "type": ["integer", "null"], "minimum": 1, "maximum": 65535 },
        "public_hostname": { "type": ["string", "null"] },
        "proxy_port": { "type": ["integer", "null"], "minimum": 1, "maximum": 65535 },
        "trusted_proxies": { "type": "array", "items": { "type": "string" }, "uniqueItems": true },
        "trusted_proxy_networks": { "type": "array", "items": { "type": "string" }, "uniqueItems": true }
      }
    },
    "streaming": {
      "type": "object",
      "additionalProperties": false,
      "required": ["remote_quality", "upload_protection_enabled", "reserved_upload_mbps", "concurrent_remote_streams"],
      "properties": {
        "remote_quality": { "enum": ["automatic", "original", "1080p", "720p", "data-saver"] },
        "upload_protection_enabled": { "type": "boolean" },
        "reserved_upload_mbps": { "type": "integer", "minimum": 0, "maximum": 10000 },
        "concurrent_remote_streams": { "const": "automatic" }
      }
    },
    "native_app_access": {
      "type": "object",
      "additionalProperties": false,
      "properties": {
        "allow_browser_apps": { "type": "boolean" }
      }
    }
  }
}
